{
  "schema": "dc.profile/1",
  "id": "DCX-UHD60",
  "version": 1,
  "kind": "session",
  "title": "Session experience: UHD60 delivered on the current display (ADR-0022)",
  "requires": [
    { "host_profile": "DCP-2026-RENDER-UHD60" },
    { "mode": { "min_width": 3840, "min_height": 2160, "min_refresh_hz": 60 } }
  ]
}
